,title,subtitle,link
0,TOP RUN,Tom Cruise dumped by Hayley Atwell as she moves on with vegetarian pagan,https://www.thesun.co.uk/tvandshowbiz/19065556/tom-cruise-pagan-hayley-atwell/
1,WE'RE OVER,Rachel Stevens announces shock split from husband of 12 years Alex Bourne,https://www.thesun.co.uk/tv/19066084/rachel-stevens-alex-bourne-marriage-split/
2,BEEB SWITCH,Scott Mills quits Radio 1 and takes over from Steve Wright in radio shake-up,https://www.thesun.co.uk/tv/19065725/scott-mills-steve-wright-radio-1-2/
3,SAND BANK,Popular holiday hotspot to CHARGE tourists to sunbathe on the beaches,https://www.thesun.co.uk/travel/19059622/beach-sunbathe-cost-tourists-italy/
4,SAFE AS HOUSES,Major change after lenders offer mortgages which can be passed onto kids,https://www.thesun.co.uk/news/19066956/major-change-mortgages-homeowners-pass-to-kids/
5,LURID CLAIMS,"I woke up in Chris Pincher's flat with him on top of me, 'victim' claims",https://www.thesun.co.uk/news/19066510/woke-chris-pinchers-flat-find-him-on-top/
6,THE SUN SAYS,PM should have IMMEDIATELY kicked Pincher off Tory benches for 'groping' shame,https://www.thesun.co.uk/news/19066822/boris-johnson-chris-pincher-groping-scandal/
7,SPORTS SALE,JD Sports launch summer sale with up to 50% off,https://www.thesun.co.uk/fabulous/18942677/jd-sports-summer-sale-half-price-deals/
8,DEAR DEIDRE,Sparks flew when I met my girlfriend - but is she my sister?,https://www.thesun.co.uk/dear-deidre/19058222/sparks-flew-girlfriend-my-sister/
9,SUPER SIXTY,F1 - British Grand Prix: Get Lewis Hamilton at 60/1 to finish on the podium,https://www.thesun.co.uk/sport/betting-tips/19047828/f1-british-grand-prix-lewis-hamilton-betting-odds-free-bets/
10,LOVE HOUSE,Love Island recap - Casa Amor drama as new boys arrive & Charlie & Antongini go,https://www.thesun.co.uk/tv/18798267/love-island-2022-live-cast-latest-gemma-owen/
11,TRAVEL HELL,Live flight cancellations as Brits face utter carnage at Heathrow,https://www.thesun.co.uk/travel/19045154/flights-cancelled-delays-news-ryanair/
12,WIMBLEDON 2022,"Brit Cam Norrie THRASHES Johnson, Djokovic WINS, Watson into round 4",https://www.thesun.co.uk/sport/19007120/wimbledon-live-results-tv-cam-norrie-djokovic-watson-stream-free/
13,VAT WAR,No10 at loggerheads with Rishi Sunak over plans to slash VAT on food prices,https://www.thesun.co.uk/news/19066752/rishi-sunak-vat-food-prices/
14,DATE RAPE HELL,Rapist who targeted married straight men in club may have 100s more victims,https://www.thesun.co.uk/news/19067576/rapist-targeted-married-straight-men-club-more-victims/
15,C U AGAIN,I'm A Celebrity All Star bosses in talks with controversial former contestant,https://www.thesun.co.uk/tv/19064535/im-a-celebrity-former-contestant-c/
16,STREETS OF RAGE,MMA fighter takes on two men in mass brawl while cheered on by glam boxer,https://www.thesun.co.uk/news/19064178/mass-brawl-mma-fighter-takes-on-two-men/
17,BOMBSHELL CLAIMS,Love Island star accuses ex of ‘inappropriate touching’ - but he denies it,https://www.thesun.co.uk/tvandshowbiz/19061752/love-island-hugo-hammond-inappropriate-touching-allegation-sharon-gaffka/
18,GLITCH IN THE MATRIX,Man uncovers 'secret lair' UNDER train station in jaw-dropping find,https://www.thesun.co.uk/news/19063667/man-uncovers-secret-lair-tiktok-sheffield/
19,POWER HOURS,You won't believe how much these celebs make for just 60 minutes' work,https://www.thesun.co.uk/tvandshowbiz/19065553/celebs-make-60-minutes-work/
20,VIRUS SURGE,UK Covid cases soar by a third in a week with one in 30 Brits infected,https://www.thesun.co.uk/health/19067089/uk-covid-cases-soar-by-third-in-week/
21,SO LUCKY,I was on Neighbours when it started & there was one star who outshone everyone,https://www.thesun.co.uk/tv/19066292/harold-bishop-kylie-minogue-neighbours-ends/
22,ULRIKA JONSSON,Why does Victoria Beckham deny herself delicious food to stay stick-thin?,https://www.thesun.co.uk/news/19065369/victoria-beckham-ulrika-jonsson-food/
23,HELL FACTORY,Inside China's secret slaughterhouse where stolen pets are blowtorched as meat,https://www.thesun.co.uk/news/19056514/yulin-dog-meat-festival-animal-cruelty-china/
24,SICK & TWISTED,Evil killer Oscar Pistorius met Reeva's dad in jail in desperate freedom bid,https://www.thesun.co.uk/news/19067279/oscar-pistorius-met-dad-reena-steenkamp/
25,SEX PEST SCANDAL,Why did it take Boris Johnson so long to ditch drunken Chris Pincher?,https://www.thesun.co.uk/news/19066063/boris-johnson-boots-chris-pincher-tory-party-drunken-groping/
26,ISABEL HARDMAN,Sleaze scandals are a problem that all parties have to tackle,https://www.thesun.co.uk/news/19066729/sleaze-revelations-problem-all-parties-to-tackle/
27,'CHEER UP',"Labour MPs should drink champagne so they become more fun, says Jacob Rees-Mogg",https://www.thesun.co.uk/news/19067079/labour-champagne-jacob-rees-mogg/
28,NOT HAPPY,Putin hits back at 'disgusting' G7 leaders after despot MOCKED for shirtless pics,https://www.thesun.co.uk/news/19037283/ukraine-news-russia-war-latest-putin-bernie-ecclestone/
29,NEW BALLS PLEASE,Watch Warner go down in pain after being hit in balls with flying BAIL,https://www.thesun.co.uk/sport/19061716/david-warner-australia-cricket-hit-in-balls/
30,MIGHTY RE-LEAF,Harvester makes major U-turn after threatening to scrap fan favourite,https://www.thesun.co.uk/money/19064851/harvester-u-turn-salad-bar/
31,BARE IT,Study reveals the exact temperature that makes Brits wear shorts and T-shirts,https://www.thesun.co.uk/news/19066342/exact-temperature-brits-shorts/
32,SHOW & TELL,I'm on Babestation - here's what it's like to strip on TV & the weird requests,https://www.thesun.co.uk/news/19058894/babestation-model-strip-on-tv/
33,OKEY-COKEY,Kate Moss stuns fans with bizarre new career move,https://www.thesun.co.uk/tvandshowbiz/19066047/kate-moss-bizarre-career-move/
34,HORROR BLAZE,"Woman, 79, killed & two men, in serious condition after house fire breaks out",https://www.thesun.co.uk/news/19065038/woman-dies-men-hurt-house-fire-scotland/
35,'BLOOD WAS DRAWN',"Waitress, 20, slammed for BITING cop while drunk after birthday bash",https://www.thesun.co.uk/news/19066357/ludicrously-drunk-waitress-bits-cop-at-birthday-party/
36,BANK PROTEST,Fury as Halifax bosses urge staff to display pronouns on name badges,https://www.thesun.co.uk/news/19067064/halifax-customers-quit-gender-pronoun-row/
37,DOUGLAS MURRAY,Halifax's pronoun policy is woke madness and people should quit the bank,https://www.thesun.co.uk/uncategorized/19066525/douglas-murray-halifax-pronoun-madness/
38,FINAL FAREWELL,Updates on Minecraft YouTube star who died at 23 as sarcoma battle revealed,https://www.thesun.co.uk/tech/19056978/youtuber-technoblade-death-sarcoma-cancer-live-updates/
39,ROYAL TRUCE,Queen 'drawing a line' under Meghan & Harry drama as report to remain SECRET,https://www.thesun.co.uk/fabulous/19033920/meghan-markle-news-prince-harry-latest-queen-bullying/
40,WASHOUT,Brits told to prepare for stormy weekend before 30C Azores heatwave hits nation,https://www.thesun.co.uk/news/19051154/uk-weather-forecast-latest-met-office-warnings-heatwave/
41,LADIES' NIGHT,Love Island's stunning Casa Amor GIRLS revealed as they arrive to tempt boys,https://www.thesun.co.uk/tv/19066808/love-island-casa-amor-girls-revealed/
42,HERE COMES TROUBLE,Love Island's Casa Amor boys revealed - and one has a world famous dad,https://www.thesun.co.uk/tv/19063765/love-island-casa-amor-boys-ronan-keating-jack/
43,'WHAT?',Love Island fans stunned as Antigoni and Charlie are brutally dumped,https://www.thesun.co.uk/tv/19066197/love-island-antigoni-charlie-brutally-dumped/
44,'WHAT HAPPENED',Love Island fans spot 'secret feud' claiming Paige hates a fellow Islander,https://www.thesun.co.uk/tv/19066485/love-island-secret-feud-paige-hates-islander/
45,GIRL'S CASA,Love Island reveals first look at Casa Amor as the GIRLS are set to head in,https://www.thesun.co.uk/tv/19064060/love-island-first-look-casa-amor-girls-new-boys/
46,MET SHAME,Two Met cops sacked after posting sick WhatsApp messages about Meghan Markle,https://www.thesun.co.uk/news/19064287/met-police-sacked-racist-meghan-markle/
47,SUMMER MELTDOWN,Brits holiday nightmare as airlines to 'announce new wave of cancellations',https://www.thesun.co.uk/travel/19066760/brits-holiday-nightmare-airlines-announce-more-flight-cancellations/
48,ROLLING IN IT,EuroMillions prize rolls over to £186m – you could be biggest winner EVER,https://www.thesun.co.uk/money/19066778/euromillions-rollover-tuesday-biggest-ever-jackpot/
49,TREVOR KAVANAGH,Covid public inquiry is a waste of time and money - I know who is to blame,https://www.thesun.co.uk/news/19065084/covid-public-inquiry-trevor-kavanagh/
50,SHOW ME THE MONEY,Worker vanishes after being wrongly paid £150k - 300 times his salary,https://www.thesun.co.uk/news/19065098/worker-vanishes-accidentally-paid-150000-for-month-work/
51,BLUNDER BIRD,"Racing pigeon takes wrong turn....and ends up 5,000 miles away in US",https://www.thesun.co.uk/news/19066796/racing-pigeon-takes-wrong-turn/
52,TOMB MYSTERY,"Digging work begins at 5,000-year-old tomb linked to King Arthur",https://www.thesun.co.uk/news/19066111/king-arthur-tomb-dig/
53,MONEY MAKER,I make £800 extra a month with an ‘amazing’ side hustle business,https://www.thesun.co.uk/money/19064445/side-hustle-dawn-beauty/
54,FAITH SHOCK,The everyday activity which can slash risk of Parkinson's by up to 90 per cent,https://www.thesun.co.uk/health/19065191/church-slask-risk-parkinsons/
55,MURDER PROBE,"Cops launch hunt for 'wanted man', 34, 'on the run' after body found at home",https://www.thesun.co.uk/news/19065287/murder-suspect-manhunt-gloucester-police/
56,TOP GUYS,What James May really thinks of Top Gear’s new hosts - and why women love Clarkson,https://www.thesun.co.uk/news/19064840/new-top-gear-hosts-not-appealing-women-james-may/
57,PLUME-ING LOVELY,Glamorous Strictly star Emma Weymouth wows in baby blue dress,https://www.thesun.co.uk/tv/19067127/emma-weymouth-strictly-baby-blue/
58,OPENING UP,Louise Thompson breaks silence after hospital dash to give fans health update,https://www.thesun.co.uk/tv/19061330/louise-thompson-breaks-silence-hospital-dash/
59,MADE A BOOB BOO,Alison Hammond's boobs go flying in terrifying high-speed car race,https://www.thesun.co.uk/tv/19061183/this-morning-alison-hammond-apologise-boobs/
60,DOUBLE EXIT,EastEnders theory - TWO major Walford characters to EXIT in prison break plot,https://www.thesun.co.uk/tv/19045906/eastenders-spoilers-theories-coronation-street-news-emmerdale/
61,BUM DEAL,Kim Kardashian getting rid of her famous bum for surprising reason,https://www.thesun.co.uk/tvandshowbiz/19062917/kim-kardashian-bum-stops-bbl-pete-davidson-kanye/
62,TOP TEAR,Stranger Things fans 'can't stop crying' as Netflix finally drops season 4 finale,https://www.thesun.co.uk/tv/19063395/stranger-things-fans-cry-season-four-drops-netflix/
63,HOSPITAL DASH,Dancing On Ice star rushed to hospital saying he's lost his memory,https://www.thesun.co.uk/tv/19058699/dancing-on-ice-hospital-brain-infection/
64,GLAM ATACK,Emily Atack looks incredible in low cut dress in first look at her sketch show,https://www.thesun.co.uk/tv/19057797/emily-atack-incredible-low-cut-dress-sketch-show/
65,AISLE SAY,EastEnders' Louisa Lytton poses for snaps before wedding celebrations TOMORROW,https://www.thesun.co.uk/tv/19060764/eastenders-louisa-lytton-baby-daughter-married-tomorrow/
66,SOMEONE LIKE POO,Adele tears up and admits 'I'm s***ting myself' at comeback concert,https://www.thesun.co.uk/tvandshowbiz/19066795/adele-first-gig-five-years/
67,BEY'S LADY GO-DIVA,Bejewelled Beyoncé channels Lady Godiva on racy new album cover,https://www.thesun.co.uk/tvandshowbiz/19065722/beyonce-godiva-new-album-cover/
68,DARE TO BARE,Kim poses with NO underwear or bra in see-through dress for new NSFW photos,https://www.thesun.co.uk/tv/19053917/kim-kardashian-poses-no-underwear-bra-dress/
69,DOGGY DRAMA,Peter Andre takes a swipe at Katie Price as daughter Princess asks for a dog,https://www.thesun.co.uk/tvandshowbiz/19053254/peter-andre-swipe-katie-price-princess-dog/
70,ADDICTION HELL,I'd hit myself over the head to get prescription drugs reveals Ozzy Osbourne,https://www.thesun.co.uk/tvandshowbiz/19066037/ozzy-osbourne-hit-himself-for-drugs/
71,RUDE DUDES,I'm a Ukrainian influencer & men use the war as an excuse to hit on me - they're obsessed with my 30HH boobs,https://www.thesun.co.uk/fabulous/19061970/ukranian-influencer-big-boobs-sexist-men-problems/
72,PAGE-TURNERS,I’m a best-selling author - here are 20 hottest books to dive into this summer,https://www.thesun.co.uk/fabulous/19066133/hottest-books-this-summer/
73,MYSTIC MEG,July 2: Romance that promised so much now starts to deliver,https://www.thesun.co.uk/fabulous/horoscopes/19056364/horoscope-today-july-2-2022-star-sign-mystic-meg/
74,MAKING HER MARK,5 signs Meghan is eyeing political career - including 'copying' the Obamas,https://www.thesun.co.uk/fabulous/19049671/meghan-markle-prince-harry-politics-obamas/
75,'EVERY SINGLE DAY',Harry sees Diana's 'legacy' in his children as he recalls her 'fire',https://www.thesun.co.uk/fabulous/19065898/prince-harry-tribute-diana-birthday-william/
76,ROYAL RICHES,Cost of William & Kate's Caribbean tour REVEALED in annual spending report,https://www.thesun.co.uk/fabulous/19033442/queen-elizabeth-news-prince-william-kate-middleton-royals-taxpayer/
77,GOING NUTS,If you can find all 3 coconuts in this image in 30 seconds you're in the top 1%,https://www.thesun.co.uk/fabulous/19062733/find-all-three-coconuts-image-can-you-spot-them/
78,OH BABY,I gave birth in just 2 pushes & contractions were like period pain - mums hate me,https://www.thesun.co.uk/fabulous/19064198/woman-gave-birth-two-pushes-mums-hate/
79,BUSTED,I'm a fashion pro & all big boobed girls need to know my five tips to look classy,https://www.thesun.co.uk/fabulous/19064949/fashion-pro-big-boobs-tips-look-classy/
80,CODE CRACKED,Fashion pro shares Zara label codes REAL meaning & it's not what you think,https://www.thesun.co.uk/fabulous/19063342/fashion-expert-zara-labels-meaning-circle-triangle-square/
81,NO KIDDING,I used to spend £225 on food a week - now I feed my family-of-4 for £5 a day,https://www.thesun.co.uk/fabulous/19066602/mum-food-shop-saved-fortune-easy-swaps-cheap/
82,COOL DEAL,"Air conditioner slashed by £250 in Homebase sale, plus other savings of 50%",https://www.thesun.co.uk/money/19060375/air-conditioner-homebase-summer-sale-deals/
83,SUN SEEKER,The high street's best sun loungers to buy in 2022,https://www.thesun.co.uk/sun-selects/8532938/best-sun-loungers/
84,FREE FIVER,How to get a £5 Amazon credit by streaming ONE single song,https://www.thesun.co.uk/tech/19045983/amazon-music-prime-free-credit-deal/
85,SUPER FAN,'Real' footie fans can name England's 1966 World Cup team - how many do you know?,https://www.thesun.co.uk/sport/19065516/fans-name-englands-1966-team/
86,ADRIAN CHILES,Something big is about to happen in English footie & not with usual culprits,https://www.thesun.co.uk/news/19065870/something-big-about-to-happen-english-football/
87,KATIE ROARS,Katie Boulter sports England Lionesses shirt ahead of crunch Wimbledon clash,https://www.thesun.co.uk/sport/19066643/katie-boulter-lionesses-shirt/
88,WHITE'S CLIFFS OF DOVER,Huge image of England ace is projected onto iconic Kent landmark,https://www.thesun.co.uk/sport/19058391/ellen-white-cliffs-of-dover-england/
89,'HAPPY DAY',Salah confirms new Liverpool deal with brilliant post as wages DOUBLE to £400k,https://www.thesun.co.uk/sport/19061554/salah-liverpool-new-contract-pay-doubles/
90,SIZZLING SARA,F1 ace Lance Stroll's girlfriend Sara Pagliaroli stuns in bikini photoshoot,https://www.thesun.co.uk/sport/19067042/lance-stroll-girlfriend-sara-pagliaroli/
91,NOSE NO BOUNDS,Hamilton takes nose stud out after race ban threat for wearing jewellery,https://www.thesun.co.uk/sport/19061311/lewis-hamilton-jewellery-piercings-nose-stud-removed/
92,WAT MORE CAN I DO?,Watson storms into last 16 & slams Wimbo chiefs for 'trying to kill her',https://www.thesun.co.uk/sport/19061933/wimbledon-heather-watson-wins-slams-schedule/
93,NO JOSHING,AJ gives huge insight into training for Usyk rematch and looks lightning-fast,https://www.thesun.co.uk/sport/19062941/anthony-joshua-oleksandr-usyk-training-insight-video/
94,TRIAL CONFIRMED,Haye to face trial in October as former boxer accused of assaulting man,https://www.thesun.co.uk/sport/19049972/david-haye-trial-assault-hammersmith-apollo-boxing/
95,HORROR ENCOUNTER,Girl loses her LEG after 9ft shark attacks her at popular US beach spot,https://www.thesun.co.uk/news/19062339/florida-keaton-beach-shark-attack-girl-loses-leg/
96,SEA BATTLE,Fisherman has arm ripped off by 15ft tiger shark as rescuers ram boat into beast,https://www.thesun.co.uk/news/19063906/fisherman-arm-ripped-off-shark/
97,GORY END,"Yoga teacher, 23, found dead in Ritz bath as cops hunt phone with 'chilling texts'",https://www.thesun.co.uk/news/19060596/yoga-teacher-found-dead-in-bath-ritz-hotel/
98,MURDER OF INNOCENTS,Two kids among 19 dead in Russian missile strike on Ukraine apartments,https://www.thesun.co.uk/news/19061731/two-children-dead-russian-missile-strike-ukraine/
99,STRUNG UP,My neighbours told me to stop my dog barking - I came home to find him HANGED,https://www.thesun.co.uk/news/19050982/my-dog-hanged-over-neighbour-row/
100,ON THE BORDER,My neighbour's put up a 6ft fence to keep me out… but I think I can go in,https://www.thesun.co.uk/money/19062482/neighbours-fence-off-land-access-row/
101,SAFE AS HOUSES,One-bedroom property to let for £975 a month – but it comes with a catch,https://www.thesun.co.uk/news/19061114/one-bedroom-property-trendy-bristol/
102,'NO CHOICE',I was forced out of my home after my greedy landlord increased the rent by 35%,https://www.thesun.co.uk/money/19045970/forced-out-greedy-landlord-increased-rent/
103,CRAMPED LIVING,Tiny London flat is extortionate at £1k-a-month & it's missing a key feature,https://www.thesun.co.uk/money/19046342/tiny-london-flat-extortionate-missing/
104,WE'RE ALL MAD HERE,Inside the 'mad' Alice in Wonderland hotel featured on Four in a Bed,https://www.thesun.co.uk/tv/19049494/alice-wonderland-hatters-hotel-channel-4/
105,PLANE CRAZY,The tiny travel toiletries rip off - the 12 products you need to avoid,https://www.thesun.co.uk/money/19065841/tiny-travel-toiletries-rip-off/
106,AVOID A RUFF DEAL,Six tips for getting the right pet insurance deal as prices rocket,https://www.thesun.co.uk/news/19056383/how-to-to-getting-best-pet-insurance-deal/
107,SAUCE OF HAPPINESS,The best budget tomato ketchup cost just a third of the price of Heinz,https://www.thesun.co.uk/money/19065124/budget-tomato-ketchup-heinz-test/
108,MYSTERY DEBT,"I can’t afford to buy food after I was told to pay back £2,000 of benefits",https://www.thesun.co.uk/money/19059069/mystery-benefit-payment-dwp/
109,SUN SAVERS,Five ways to give your home a sweet summer scent,https://www.thesun.co.uk/money/19063743/home-scent-summer-sun-savers/
110,AUSTIN'S POWER,The Texan city with taco breakfasts & live music with daily flights from UK,https://www.thesun.co.uk/travel/19056541/buzz-around-texan-capital-austin-music/
111,NIGHTMARE,I missed my flight after blundering airport staff left me stranded in wheelchair,https://www.thesun.co.uk/news/19062626/ryanair-flight-blundering-airport-staff-stranded-wheelchair/
112,VROOM WITH A VIEW,Ditch flights and travel France by BOAT with ensuite cabins and sundeck,https://www.thesun.co.uk/travel/19056366/cruise-france-wine-canals-yacht/
113,MOBILE GETAWAY,Why a staycation on a royal campsite is perfect for the summer,https://www.thesun.co.uk/travel/19066257/staycation-campsite-summer-norfolk-suffolk/
114,SHE'S HAVEN IT,Mum reveals how to get bargain Haven family holiday for £6.80pp a night,https://www.thesun.co.uk/travel/19061226/haven-cheap-famiily-holiday-deal-trick/
115,OUR HERO,How Dame Deborah James is continuing to save lives after her death,https://www.thesun.co.uk/health/19066586/dame-debs-nhs-bowel-cancer/
116,CHEERS!,Deborah James’ brother and fiancée make promise to Dame days after her tragic death,https://www.thesun.co.uk/health/19058210/deborah-james-brother-fiance-heartfelt-message-dames-death/
117,DANCING DAME,Viewers in tears as Debs dances with son & raises millions in last days,https://www.thesun.co.uk/health/19055894/deborah-james-bbc-doc-last-dance/
118,VIRAL WAVE,"Covid cases close to 300,000 a day and 'heading for highest ever levels'",https://www.thesun.co.uk/health/19051546/uk-covid-cases-heading-for-record-high-zoe/
119,SPOT CHECK,The 5 unusual monkeypox symptoms you must know as virus spreads,https://www.thesun.co.uk/health/19048829/unusual-monkeypox-symptoms-know-virus-spreads/
120,'INCREDIBLE IMPACT',Minecraft YouTuber passes away one year after cancer diagnosis,https://www.thesun.co.uk/tech/19056947/technoblade-minecraft-youtube-death-cancer-news/
121,APPLE RUMBLE,iPhone running slow? The 5 signs something is VERY wrong with your device,https://www.thesun.co.uk/tech/19057927/iphone-running-slow-five-warning-signs-wrong-device/
122,NEXT BEZ THING,Amazon billionaire Jeff Bezos logs off and heads to shops in person,https://www.thesun.co.uk/news/19055870/amazon-billionaire-jeff-bezos-shops-in-person/
123,PINCH ME,Horrifying new crab species covered in 'hair' identified by scientists,https://www.thesun.co.uk/tech/19048756/hairy-sponge-crab-discovered-australia/
124,SUN BURN,Largest solar storm in history 'blasted Earth for DAYS and caused fires',https://www.thesun.co.uk/tech/19054577/largest-solar-storm-history-earth-fires/
125,SPORE WHEEL DRIVE,I left my car for 3 weeks and when I came back it was covered in MOULD,https://www.thesun.co.uk/motors/19065748/model-finds-car-covered-mould-tiktok/
126,JET SET,Ultra rare Lamborghini inspired by a FIGHTER JET for sale at eye-watering price,https://www.thesun.co.uk/motors/19059906/rare-lamborghini-up-for-auction-this-weekend/
127,FORMULA TONNE,Inside Jenson Button's GIGANTIC £1.5M motorhome with its own CCTV system,https://www.thesun.co.uk/motors/19058628/inside-jenson-buttons-gigantic-1-5million-motorhome/
128,PULL THE PLUG,Most Brits struggle to switch to e-cars - these are the biggest reasons,https://www.thesun.co.uk/motors/19053990/reasons-why-brits-struggling-with-electric-car-adoption/
129,KICK BACK,Controversial new Highway Code rules come into force TODAY - but there's a catch,https://www.thesun.co.uk/motors/19061888/controversial-new-highway-code-rules/
